{"event_id":"550e8400-e29b-41d4-a716-446655440020","partition_key":"600000.XSHG","provider":"SIM","instrument_id":"600000.XSHG","exchange":"XSHG","calendar_version":"cal-v1","session_id":"am","event_time":"2026-08-11T01:30:00Z","received_at":"2026-08-11T01:30:00.001Z","quality_version":2,"previous_quality":"RECOVERING","quality":"NORMAL","reason_code":"RECOVERY_VERIFIED","source_sequence":10,"unresolved_gap_count":0,"gap_start_sequence":null,"gap_end_sequence":null,"recovery_checkpoint":"aaaaaaaaaaaaaaaaaaaaaaaaaaaaaaaaaaaaaaaaaaaaaaaaaaaaaaaaaaaaaaaa"}
